"RMSE_rank","Model","Family","RMSE","vs_ARIMAX_pct","Dir_Acc_pct","Parameters_or_complexity","Weekly_timing_use","Training_burden","Interpretability","Capstone_role","Thesis_takeaway"
1,"MIDAS nbeta","Parametric MIDAS",0.02057,-31.1,74,"3 lag-shape parameters","Smooth beta lag curve over 12 weekly lags","Low","High","Best RMSE model","Best overall accuracy; strongest main result."
2,"LASSO-MIDAS","Regularised MIDAS",0.02103,-29.6,76,"11 nonzero weekly coefficients","Sparse weekly lag selection","Medium","Medium-high","Feature-selection robustness","Independently selects the prior-month lag window."
3,"MIDAS nealmon","Parametric MIDAS",0.02104,-29.5,80.2,"3 lag-shape parameters","Smooth Almon lag curve over 12 weekly lags","Low","High","Best directional model","Best sign accuracy and easiest defense model."
4,"U-MIDAS","Unrestricted MIDAS",0.02226,-25.5,75,"12 free weekly coefficients","Free coefficient for each weekly lag","Low","Medium","Flexible MIDAS benchmark","Weekly timing matters even without shape restrictions."
5,"Kernel U-MIDAS","Non-parametric MIDAS",0.02226,-25.5,75,"12 lags + smoothness penalty","Smooth non-parametric weekly lag curve","Low-medium","High","Non-parametric smoother robustness","Validation chooses no extra smoothing; U-MIDAS is enough."
6,"CLM-SS (12 lags)","State-space MIDAS-style",0.02258,-24.4,74,"12 link weights + AR(1) state","Exact weekly link weights plus AR error","Medium","High","Novel exact aggregation framework","Confirms lag hump but does not beat parametric MIDAS."
7,"XGBoost","Machine learning",0.02365,-20.8,72.9,"Tree ensemble over 14 features","Tabular weekly lag features","Medium","Medium-low","Tree-based ML benchmark","Beats ARIMAX but trails MIDAS; confirms lag hump."
8,"LSTM","Machine learning",0.02588,-13.3,76,"LSTM hidden=4, epochs=150","Sequential 12-week WTI input","High","Low","Deep-learning benchmark","Beats ARIMAX but complexity is not rewarded."
9,"ARIMAX","Monthly benchmark",0.02986,0,64.6,"ARMA + monthly mean WTI","Aggregates WTI to monthly mean","Low","Medium","Baseline to beat","Monthly pre-aggregation loses weekly timing."
